{"schemaVersion": 1, "duration": 1, "bones": [{"id": "root", "visible": false, "length": 1, "layer": -20}, {"id": "back", "parent": "root", "image": "red.png", "x": -10, "y": -10, "length": 40, "width": 40, "pivotX": 0.5, "pivotY": 0.5, "layer": 1}, {"id": "front", "parent": "back", "image": "blue.png", "x": 10, "y": 10, "length": 40, "width": 40, "pivotX": 0.5, "pivotY": 0.5, "layer": 2}, {"id": "side", "parent": "root", "image": "green.png", "x": 70, "length": 40, "width": 40, "pivotX": 0.5, "pivotY": 0.5, "layer": 2}], "frames": [{"time": 0, "pose": {}}, {"time": 0.5, "pose": {"back": 25, "front": -10}}, {"time": 1, "pose": {}}]}